{
  "deck_id": "piti_slide_spec_productive_finance_policy",
  "story_seed_title": "생산적 금융과 정책자금 전환",
  "source_storyline_id": "anny_dry_run_productive_finance_policy_v1_enriched",
  "source_storyline_path": "outputs/model_dry_runs/anny_storyline/productive_finance_policy_gpt_pro_storyline_enriched.json",
  "sections": [
    {
      "section_id": "section_01",
      "section_no": 1,
      "section_title": "안전한 금융의 본능과 새로운 질문",
      "purpose": "담보 중심 금융의 자연스러운 논리와 문제 제기를 세운다.",
      "slides": [
        {
          "slide_id": "productive_finance_policy_slide_01",
          "slide_no": 1,
          "section_id": "section_01",
          "source_slide_refs": [
            1
          ],
          "layout_intent": "title",
          "screen_headline": "생산적 금융과 정책자금 전환",
          "screen_body": [
            "금융은 안전하게 돈을 빌려주는 산업인가",
            "아니면 성장 위험을 나눠지는 산업인가"
          ],
          "speaker_notes_expanded": "방송용 전환/질문 slide. 사실 주장으로 과확장하지 말 것.",
          "overflow_notes": [],
          "proof_object": {
            "type": "none",
            "screen_position": "none",
            "source_name": null,
            "display_title": null,
            "quote_text": null,
            "quote_translation": null,
            "source_url": null,
            "image_url": null,
            "chart_title": null,
            "chart_source_label": null,
            "data_hint": null,
            "diagram_nodes": [],
            "diagram_edges": [],
            "placeholder_reason": null,
            "manual_insert_required": false,
            "copyright_risk": false
          },
          "editor_instruction": null,
          "source_refs": [],
          "risk_flags": [],
          "needs_source": false,
          "needs_fact_check": false,
          "required_before_broadcast": false,
          "do_not_claim": [],
          "fact_check_kind": "rhetorical_caution",
          "fact_check_priority": "low"
        },
        {
          "slide_id": "productive_finance_policy_slide_02",
          "slide_no": 2,
          "section_id": "section_01",
          "source_slide_refs": [
            2
          ],
          "layout_intent": "chart_table_reference",
          "screen_headline": "금융위원장이 던진 질문 하나",
          "screen_body": [],
          "speaker_notes_expanded": "[내용] 연합인포맥스 후보 기사 + 금융위원회 공식자료. 발언 원문 맥락은 방송 전 재확인.\n[overflow_notes]\n“담보 및 단기수익 중심 금융 경쟁은 앞서가기 어렵다”는 문제 제기가 나왔다.\n금융위원회 공식자료는 국민성장펀드가 5년간 150조 원, 2026년 30조 원 규모로 첨단산업 생태계에 자금을 공급하는 틀이라고 설명한다.\n다만 이 발언과 정책 숫자가 곧 정책 성공을 뜻하는 것은 아니다.\n[source_ref] primary_article | 이억원 금융위원장 발언과 후보 기사 맥락 | https://news.einfomax.co.kr/news/articleView.html?idxno=4415444\n[source_ref] primary_official_source | 국민성장펀드 150조/2026년 30조 운용 방안과 투자 방식 확인 | https://www.fsc.go.kr/no010101/86834?curPage=2&srchBeginDt=&srchCtgry=&srchEndDt=&srchKey=&srchText=\n[check] needs_fact_check=true\n[check] required_before_broadcast=true",
          "overflow_notes": [
            "“담보 및 단기수익 중심 금융 경쟁은 앞서가기 어렵다”는 문제 제기가 나왔다.",
            "금융위원회 공식자료는 국민성장펀드가 5년간 150조 원, 2026년 30조 원 규모로 첨단산업 생태계에 자금을 공급하는 틀이라고 설명한다.",
            "다만 이 발언과 정책 숫자가 곧 정책 성공을 뜻하는 것은 아니다."
          ],
          "proof_object": {
            "type": "chart",
            "screen_position": "full_width_chart",
            "source_name": "연합인포맥스",
            "display_title": null,
            "quote_text": null,
            "quote_translation": null,
            "source_url": "https://news.einfomax.co.kr/news/articleView.html?idxno=4415444",
            "image_url": null,
            "chart_title": "금융위원장이 던진 질문 하나",
            "chart_source_label": "(출처: 연합인포맥스)",
            "data_hint": "“담보 및 단기수익 중심 금융 경쟁은 앞서가기 어렵다”는 문제 제기가 나왔다.; 금융위원회 공식자료는 국민성장펀드가 5년간 150조 원, 2026년 30조 원 규모로 첨단산업 생태계에 자금을 공급하는 틀이라고 설명한다.; 다만 이 발언과 정책 숫자가 곧 정책 성공을 뜻하는 것은 아니다.",
            "diagram_nodes": [],
            "diagram_edges": [],
            "placeholder_reason": null,
            "manual_insert_required": true,
            "copyright_risk": false
          },
          "editor_instruction": "Chart/table data must be manually designed before broadcast. Manual fact-check required before broadcast.",
          "source_refs": [
            {
              "url": "https://news.einfomax.co.kr/news/articleView.html?idxno=4415444",
              "role": "primary_article",
              "use": "이억원 금융위원장 발언과 후보 기사 맥락",
              "confidence": "medium",
              "manual_check_required": true
            },
            {
              "url": "https://www.fsc.go.kr/no010101/86834?curPage=2&srchBeginDt=&srchCtgry=&srchEndDt=&srchKey=&srchText=",
              "role": "primary_official_source",
              "use": "국민성장펀드 150조/2026년 30조 운용 방안과 투자 방식 확인",
              "confidence": "high",
              "manual_check_required": false
            }
          ],
          "risk_flags": [],
          "needs_source": false,
          "needs_fact_check": true,
          "required_before_broadcast": true,
          "do_not_claim": [],
          "fact_check_kind": "institution_quote_context",
          "fact_check_priority": "high"
        },
        {
          "slide_id": "productive_finance_policy_slide_03",
          "slide_no": 3,
          "section_id": "section_01",
          "source_slide_refs": [
            3
          ],
          "layout_intent": "diagram",
          "screen_headline": "은행 입장에서는 담보가 제일 편하다",
          "screen_body": [],
          "speaker_notes_expanded": "[근거] BIS Basel III 프레임워크 + 국내 인내자본/건전성 규제 논의. 국내 감독규정은 방송 전 추가 확인.\n[overflow_notes]\n돈을 빌려줄 때 가장 쉬운 질문은 “담보가 있나?”다.\n은행은 자본규제와 위험가중자산을 고려해야 하므로, 위험한 자산을 무한정 늘릴 수 없다.\n그래서 장기 위험자본 논의는 은행의 본능을 비난하는 문제가 아니라 금융 시스템의 설계 문제에 가깝다.\n[source_ref] market_finance_view | 은행 자본규제와 위험가중자산 논리 배경 | https://www.bis.org/bcbs/basel3.htm\n[source_ref] market_finance_view | 장기 인내자본과 은행 건전성 규제 국내 논의 | https://www.donga.com/news/Economy/article/all/20251113/132765077/4\n[check] needs_fact_check=true\n[check] required_before_broadcast=true",
          "overflow_notes": [
            "돈을 빌려줄 때 가장 쉬운 질문은 “담보가 있나?”다.",
            "은행은 자본규제와 위험가중자산을 고려해야 하므로, 위험한 자산을 무한정 늘릴 수 없다.",
            "그래서 장기 위험자본 논의는 은행의 본능을 비난하는 문제가 아니라 금융 시스템의 설계 문제에 가깝다."
          ],
          "proof_object": {
            "type": "diagram",
            "screen_position": "center_large",
            "source_name": "BIS",
            "display_title": null,
            "quote_text": null,
            "quote_translation": null,
            "source_url": "https://www.bis.org/bcbs/basel3.htm",
            "image_url": null,
            "chart_title": null,
            "chart_source_label": null,
            "data_hint": null,
            "diagram_nodes": [
              "질문",
              "검증",
              "맥락"
            ],
            "diagram_edges": [
              {
                "from": "질문",
                "to": "검증",
                "label": "출처 확인"
              },
              {
                "from": "검증",
                "to": "맥락",
                "label": "다른 자료와 비교"
              }
            ],
            "placeholder_reason": "Diagram nodes/edges provided for editable scaffold.",
            "manual_insert_required": true,
            "copyright_risk": false
          },
          "editor_instruction": "Manual fact-check required before broadcast.",
          "source_refs": [
            {
              "url": "https://www.bis.org/bcbs/basel3.htm",
              "role": "market_finance_view",
              "use": "은행 자본규제와 위험가중자산 논리 배경",
              "confidence": "high",
              "manual_check_required": false
            },
            {
              "url": "https://www.donga.com/news/Economy/article/all/20251113/132765077/4",
              "role": "market_finance_view",
              "use": "장기 인내자본과 은행 건전성 규제 국내 논의",
              "confidence": "medium",
              "manual_check_required": true
            }
          ],
          "risk_flags": [],
          "needs_source": false,
          "needs_fact_check": true,
          "required_before_broadcast": true,
          "do_not_claim": [],
          "fact_check_kind": "source_context",
          "fact_check_priority": "medium"
        },
        {
          "slide_id": "productive_finance_policy_slide_04",
          "slide_no": 4,
          "section_id": "section_01",
          "source_slide_refs": [
            4
          ],
          "layout_intent": "diagram",
          "screen_headline": "그런데 AI 산업은 담보보다 시간이 먼저 필요하다",
          "screen_body": [],
          "speaker_notes_expanded": "[근거] 국민성장펀드 AI·반도체 집중 투자 자료. 투자 효과 단정 금지.\n[overflow_notes]\nAI와 반도체는 소프트웨어 개발비만의 문제가 아니라 설비, 전력, 공정, 인력, 공급망이 함께 필요한 산업이다.\n정책자료는 국민성장펀드가 AI·반도체 같은 첨단전략산업에 장기 자금을 공급하려는 틀이라고 설명한다.\n그래서 이 이야기는 “대출을 늘리자”보다 “누가 긴 위험을 나눌 것인가”에 가깝다.\n[source_ref] official_evidence | AI·반도체 집중 투자와 장기 인내자본 필요성 확인 | https://www.korea.kr/news/policyNewsView.do?newsId=148961201&pWise=main&pWiseMain=A4\n[source_ref] official_evidence | AI·반도체·이차전지 1차 메가프로젝트와 생산적 금융 정책 맥락 확인 | https://m.korea.kr/news/policyNewsView.do?newsId=148956795\n[source_ref] primary_official_source | 국민성장펀드 150조/2026년 30조 운용 방안과 투자 방식 확인 | https://www.fsc.go.kr/no010101/86834?curPage=2&srchBeginDt=&srchCtgry=&srchEndDt=&srchKey=&srchText=\n[check] needs_fact_check=true\n[check] required_before_broadcast=true",
          "overflow_notes": [
            "AI와 반도체는 소프트웨어 개발비만의 문제가 아니라 설비, 전력, 공정, 인력, 공급망이 함께 필요한 산업이다.",
            "정책자료는 국민성장펀드가 AI·반도체 같은 첨단전략산업에 장기 자금을 공급하려는 틀이라고 설명한다.",
            "그래서 이 이야기는 “대출을 늘리자”보다 “누가 긴 위험을 나눌 것인가”에 가깝다."
          ],
          "proof_object": {
            "type": "diagram",
            "screen_position": "center_large",
            "source_name": "정책브리핑",
            "display_title": null,
            "quote_text": null,
            "quote_translation": null,
            "source_url": "https://www.korea.kr/news/policyNewsView.do?newsId=148961201&pWise=main&pWiseMain=A4",
            "image_url": null,
            "chart_title": null,